Measure_Clean,Measure_Short,SDOH_Column,Data_Type
Average reported hours per day of total nurse staff (RN+LPN+Aide) per reporting facility,Average reported hours,NHC_AVG_REP_NURSE_STAFF,SDOH
Average adjusted hours per day of total nurse staff (RN+LPN+Aide) per reporting facility,Average adjusted hours,NHC_AVG_ADJ_NURSE_STAFF,SDOH
Total number of nursing home facilities,Total number of,NHC_TOT_FACS,SDOH
"Total number of nursing home facilities per 100,000 people",Total number of,NHC_FACS_RATE,SDOH
2nd highest 1-hour measurement of Carbon Monoxide (CO) in the year (ppm),2nd highest 1-hour,EPAA_2NDMAX_CO_1HR,SDOH
2nd highest non-overlapping 8-hour average of Carbon Monoxide (CO) in the year (ppm),2nd highest non-overlapping,EPAA_2NDMAX_CO_8HR,SDOH
98th percentile of the daily max 1-hour measurements of Nitrogen Dioxide (NO2) in the year (ppb),98th percentile of,EPAA_98PR_NO2_1HR,SDOH
Annual mean of all the 1-hour measurements of Nitrogen Dioxide (NO2) in the year (ppb),Annual mean of,EPAA_MEAN_NO2_1HR,SDOH
2nd highest daily max 1-hour measurement of Ozone (O3) in the year (ppm),2nd highest daily,EPAA_2NDMAX_O3_1HR,SDOH
4th highest daily max 8-hour average of Ozone (O3) in the year (ppm),4th highest daily,EPAA_4THMAX_O3_8HR,SDOH
Maximum of all rolling 3-month averages of Lead (Pb) in the year (ug/m3),Maximum of all,EPAA_MAX_PB_3MON,SDOH
2nd highest 24-hour average of PM10 in the year,2nd highest 24-hour,EPAA_2NDMAX_PM10_24HR,SDOH
Weighted annual mean (mean weighted by calendar quarter) for the year of PM10 (ug/m3),Weighted annual mean,EPAA_MEAN_WTD_PM10,SDOH
Weighted annual mean (mean weighted by calendar quarter) for the year of PM2.5 (ug/m3),Weighted annual mean,EPAA_MEAN_WTD_PM25,SDOH
98th percentile of the daily average measurements in the year of PM2.5 (ug/m3),98th percentile of,EPAA_98PR_PM25_DAILY,SDOH
99th percentile of the daily max 1-hour measurements of Sulfur Dioxide (SO2) in the year,99th percentile of,EPAA_99PR_SO2_1HR,SDOH
2nd highest 24-hour average of Sulfur Dioxide (SO2) in the year,2nd highest 24-hour,EPAA_2NDMAX_SO2_24HR,SDOH
Annual mean of all the 1-hour measurements of Sulfur Dioxide (SO2) in the year (ppb),Annual mean of,EPAA_MEAN_SO2_1HR,SDOH
Monthly (April) average temperature (Fahrenheit),Monthly (April) average,NOAAC_AVG_TEMP_APR,SDOH
Monthly (August) average temperature (Fahrenheit),Monthly (August) average,NOAAC_AVG_TEMP_AUG,SDOH
Monthly (December) average temperature (Fahrenheit),Monthly (December) average,NOAAC_AVG_TEMP_DEC,SDOH
Monthly (February) average temperature (Fahrenheit),Monthly (February) average,NOAAC_AVG_TEMP_FEB,SDOH
Monthly (January) average temperature (Fahrenheit),Monthly (January) average,NOAAC_AVG_TEMP_JAN,SDOH
Monthly (July) average temperature (Fahrenheit),Monthly (July) average,NOAAC_AVG_TEMP_JUL,SDOH
Monthly (June) average temperature (Fahrenheit),Monthly (June) average,NOAAC_AVG_TEMP_JUN,SDOH
Monthly (March) average temperature (Fahrenheit),Monthly (March) average,NOAAC_AVG_TEMP_MAR,SDOH
Monthly (May) average temperature (Fahrenheit),Monthly (May) average,NOAAC_AVG_TEMP_MAY,SDOH
Monthly (November) average temperature (Fahrenheit),Monthly (November) average,NOAAC_AVG_TEMP_NOV,SDOH
Monthly (October) average temperature (Fahrenheit),Monthly (October) average,NOAAC_AVG_TEMP_OCT,SDOH
Monthly (September) average temperature (Fahrenheit),Monthly (September) average,NOAAC_AVG_TEMP_SEP,SDOH
Monthly (April) maximum temperature (Fahrenheit),Monthly (April) maximum,NOAAC_MAX_TEMP_APR,SDOH
Monthly (August) maximum temperature (Fahrenheit),Monthly (August) maximum,NOAAC_MAX_TEMP_AUG,SDOH
Monthly (December) maximum temperature (Fahrenheit),Monthly (December) maximum,NOAAC_MAX_TEMP_DEC,SDOH
Monthly (February) maximum temperature (Fahrenheit),Monthly (February) maximum,NOAAC_MAX_TEMP_FEB,SDOH
Monthly (January) maximum temperature (Fahrenheit),Monthly (January) maximum,NOAAC_MAX_TEMP_JAN,SDOH
Monthly (July) maximum temperature (Fahrenheit),Monthly (July) maximum,NOAAC_MAX_TEMP_JUL,SDOH
Monthly (June) maximum temperature (Fahrenheit),Monthly (June) maximum,NOAAC_MAX_TEMP_JUN,SDOH
Monthly (March) maximum temperature (Fahrenheit),Monthly (March) maximum,NOAAC_MAX_TEMP_MAR,SDOH
Monthly (May) maximum temperature (Fahrenheit),Monthly (May) maximum,NOAAC_MAX_TEMP_MAY,SDOH
Monthly (November) maximum temperature (Fahrenheit),Monthly (November) maximum,NOAAC_MAX_TEMP_NOV,SDOH
Monthly (October) maximum temperature (Fahrenheit),Monthly (October) maximum,NOAAC_MAX_TEMP_OCT,SDOH
Monthly (September) maximum temperature (Fahrenheit),Monthly (September) maximum,NOAAC_MAX_TEMP_SEP,SDOH
Monthly (April) minimum temperature (Fahrenheit),Monthly (April) minimum,NOAAC_MIN_TEMP_APR,SDOH
Monthly (August) minimum temperature (Fahrenheit),Monthly (August) minimum,NOAAC_MIN_TEMP_AUG,SDOH
Monthly (December) minimum temperature (Fahrenheit),Monthly (December) minimum,NOAAC_MIN_TEMP_DEC,SDOH
Monthly (February) minimum temperature (Fahrenheit),Monthly (February) minimum,NOAAC_MIN_TEMP_FEB,SDOH
Monthly (January) minimum temperature (Fahrenheit),Monthly (January) minimum,NOAAC_MIN_TEMP_JAN,SDOH
Monthly (July) minimum temperature (Fahrenheit),Monthly (July) minimum,NOAAC_MIN_TEMP_JUL,SDOH
Monthly (June) minimum temperature (Fahrenheit),Monthly (June) minimum,NOAAC_MIN_TEMP_JUN,SDOH
Monthly (March) minimum temperature (Fahrenheit),Monthly (March) minimum,NOAAC_MIN_TEMP_MAR,SDOH
Monthly (May) minimum temperature (Fahrenheit),Monthly (May) minimum,NOAAC_MIN_TEMP_MAY,SDOH
Monthly (November) minimum temperature (Fahrenheit),Monthly (November) minimum,NOAAC_MIN_TEMP_NOV,SDOH
Monthly (October) minimum temperature (Fahrenheit),Monthly (October) minimum,NOAAC_MIN_TEMP_OCT,SDOH
Monthly (September) minimum temperature (Fahrenheit),Monthly (September) minimum,NOAAC_MIN_TEMP_SEP,SDOH
Monthly (April) precipitation (Inches),Monthly (April) precipitation,NOAAC_PRECIPITATION_APR,SDOH
Monthly (August) precipitation (Inches),Monthly (August) precipitation,NOAAC_PRECIPITATION_AUG,SDOH
Monthly (December) precipitation (Inches),Monthly (December) precipitation,NOAAC_PRECIPITATION_DEC,SDOH
Monthly (February) precipitation (Inches),Monthly (February) precipitation,NOAAC_PRECIPITATION_FEB,SDOH
Monthly (January) precipitation (Inches),Monthly (January) precipitation,NOAAC_PRECIPITATION_JAN,SDOH
Monthly (July) precipitation (Inches),Monthly (July) precipitation,NOAAC_PRECIPITATION_JUL,SDOH
Monthly (June) precipitation (Inches),Monthly (June) precipitation,NOAAC_PRECIPITATION_JUN,SDOH
Monthly (March) precipitation (Inches),Monthly (March) precipitation,NOAAC_PRECIPITATION_MAR,SDOH
Monthly (May) precipitation (Inches),Monthly (May) precipitation,NOAAC_PRECIPITATION_MAY,SDOH
Monthly (November) precipitation (Inches),Monthly (November) precipitation,NOAAC_PRECIPITATION_NOV,SDOH
Monthly (October) precipitation (Inches),Monthly (October) precipitation,NOAAC_PRECIPITATION_OCT,SDOH
Monthly (September) precipitation (Inches),Monthly (September) precipitation,NOAAC_PRECIPITATION_SEP,SDOH
Estimated amount of damage to property incurred by the storm events during the year (Dollar),Estimated amount of,NOAAS_PROPERTY_DAMAGE,SDOH
Total number of deaths directly caused by storm events during the year,Total number of,NOAAS_TOT_DEATHS_DIRECT,SDOH
Total number of deaths indirectly caused by storm events during the year,Total number of,NOAAS_TOT_DEATHS_INDIRECT,SDOH
Total number of injuries directly caused by storm events during the year,Total number of,NOAAS_TOT_INJURIES_DIRECT,SDOH
Total number of injuries indirectly caused by storm events during the year,Total number of,NOAAS_TOT_INJURIES_INDIRECT,SDOH
Total number of storm events,Total number of,NOAAS_TOT_STORMEVENT,SDOH
Total number of tornadoes,Total number of,NOAAS_TOT_TORNADO,SDOH
Total number of wind events,Total number of,NOAAS_TOT_WIND,SDOH
Total number of hail events,Total number of,NOAAS_TOT_HAIL,SDOH
Total number of hurricanes and tropical storms,Total number of,NOAAS_TOT_HURRICANE_STORM,SDOH
Total number of floods,Total number of,NOAAS_TOT_FLOOD,SDOH
Total number of wildfires,Total number of,NOAAS_TOT_WILDFIRE,SDOH
Total number of heat events,Total number of,NOAAS_TOT_HEAT_EVENTS,SDOH
Total number of drought,Total number of,NOAAS_TOT_DROUGHT,SDOH
Estimated median household income,Estimated median household,SAIPE_MEDIAN_HH_INCOME,SDOH
Estimated percentage of people of all ages in poverty,Estimated percentage of,SAIPE_PCT_POV,SDOH
Estimated percentage of people aged 0-17 in poverty,Estimated percentage of,SAIPE_PCT_POV_0_17,SDOH
Estimated percentage of related children aged 5-17 in families in poverty,Estimated percentage of,SAIPE_PCT_POV_5_17,SDOH
Estimated number of people of all ages in poverty,Estimated number of,SAIPE_TOT_POV,SDOH
Estimated number of people aged 0-17 in poverty,Estimated number of,SAIPE_TOT_POV_0_17,SDOH
Estimated number of related children aged 5-17 in families in poverty,Estimated number of,SAIPE_TOT_POV_5_17,SDOH
Annual mean of Particulate Matter (PM2.5) concentration (µg/m3),Annual mean of,WUSTL_AVG_PM25,SDOH
Percentage of home health agencies offering nursing care services,Percentage of home,HHC_PCT_HHA_NURSING,SDOH
Percentage of home health agencies offering physical therapy services,Percentage of home,HHC_PCT_HHA_PHYS_THERAPY,SDOH
Percentage of home health agencies offering occupational therapy services,Percentage of home,HHC_PCT_HHA_OCC_THERAPY,SDOH
Percentage of home health agencies offering speech pathology services,Percentage of home,HHC_PCT_HHA_SPEECH,SDOH
Percentage of home health agencies offering medical social services,Percentage of home,HHC_PCT_HHA_MEDICAL,SDOH
Percentage of home health agencies offering home health aide services,Percentage of home,HHC_PCT_HHA_AIDE,SDOH
"Median distance in miles to the nearest urgent care, calculated using population weighted tract centroids in the county",Median distance in,HIFLD_MEDIAN_DIST_UC,SDOH
"Mean distance in miles to the nearest urgent care, calculated using population weighted tract centroids in the county",Mean distance in,HIFLD_MEAN_DIST_UC,SDOH
"Minimum distance in miles to the nearest urgent care, calculated using population weighted tract centroids in the county",Minimum distance in,HIFLD_MIN_DIST_UC,SDOH
"Maximum distance in miles to the nearest urgent care, calculated using population weighted tract centroids in the county",Maximum distance in,HIFLD_MAX_DIST_UC,SDOH
Total number of urgent care organizations,Total number of,HIFLD_UC,SDOH
"Total number of urgent care organizations per 1,000 population",Total number of,HIFLD_UC_RATE,SDOH
Total number of Indian Health Service health care facilities,Total number of,IHS_HEALTH_FACILITY,SDOH
"Total number of Indian Health Service health care facilities per 1,000 population",Total number of,IHS_HEALTH_FACILITY_RATE,SDOH
Average percentage of high-risk long-stay nursing home residents with pressure ulcers in the county,Average percentage of,LTC_AVG_PCT_PRESSURE_ULCER,SDOH
Average percentage of residents present in a nursing home on the 1st Thursday of April within the county who are black,Average percentage of,LTC_PCT_RESD_BLACK,SDOH
Average percentage of residents present in a nursing home on the 1st Thursday of April within the county who are Hispanic,Average percentage of,LTC_PCT_RESD_HISPANIC,SDOH
Average percentage of residents present in a nursing home on the 1st Thursday of April within the county who are white,Average percentage of,LTC_PCT_RESD_WHITE,SDOH
Average age of residents present in a nursing home on the 1st Thursday of April within a county,Average age of,LTC_AVG_AGE,SDOH
Percentage of nursing homes that are owned or leased by a multi-facility (chain) organization,Percentage of nursing,LTC_PCT_MULTI_FAC,SDOH
Percentage of nursing homes that are for-profit,Percentage of nursing,LTC_PCT_FOR_PROFIT,SDOH
Average acuity index of the nursing home residents in the county,Average acuity index,LTC_AVG_ACUITY_INDEX,SDOH
Total number of nursing home beds in the county,Total number of,LTC_TOT_BEDS,SDOH
"Total number of nursing home beds in the county per 1,000 population",Total number of,LTC_TOT_BEDS_RATE,SDOH
Average rehospitalization rate in the county,Average rehospitalization rate,LTC_AVG_OBS_REHOSP_RATE,SDOH
Average successful discharge rate in the county,Average successful discharge,LTC_AVG_OBS_SUCCESSFUL_DISC_RATE,SDOH
Average percentage of nursing home residents in the county whose primary support is Medicaid,Average percentage of,LTC_AVG_PCT_MEDICAID,SDOH
Average percentage of nursing home residents in the county whose primary support is Medicare,Average percentage of,LTC_AVG_PCT_MEDICARE,SDOH
Total nursing home occupancy rate in the county,Total nursing home,LTC_OCCUPANCY_RATE,SDOH
Percentage of Medicare FFS beneficiaries who are eligible for Medicaid for at least one month,Percentage of Medicare,MGV_PCT_MEDICAID,SDOH
Total number of Medicare beneficiaries with Part A and Part B,Total number of,MGV_TOT_BEN_PART_A_B,SDOH
Total number of Medicare FFS beneficiaries,Total number of,MGV_TOT_BEN_FFS,SDOH
Percentage of Medicare FFS beneficiaries who are non-Hispanic White,Percentage of Medicare,MGV_PCT_BEN_FFS_WHITE,SDOH
Percentage of Medicare FFS beneficiaries who are Black or African American,Percentage of Medicare,MGV_PCT_BEN_FFS_BLACK,SDOH
Percentage of Medicare FFS beneficiaries who are Hispanic,Percentage of Medicare,MGV_PCT_BEN_FFS_HISPANIC,SDOH
Per capita Medicare inpatient actual payment,Per capita Medicare,MGV_PER_CAPITA_ACTUAL_IP,SDOH
Per capita Medicare inpatient standardized payment,Per capita Medicare,MGV_PER_CAPITA_STD_IP,SDOH
Per capita Medicare outpatient actual payment,Per capita Medicare,MGV_PER_CAPITA_ACTUAL_OP,SDOH
Per capita Medicare outpatient standardized payment,Per capita Medicare,MGV_PER_CAPITA_STD_OP,SDOH
Per capita Medicare E&M actual payment,Per capita Medicare,MGV_PER_CAPITA_ACTUAL_EM,SDOH
Per capita Medicare E&M standardized payment,Per capita Medicare,MGV_PER_CAPITA_STD_EM,SDOH
Per capita Medicare post acute care actual payment,Per capita Medicare,MGV_PER_CAPITA_ACTUAL_PA,SDOH
Per capita Medicare post acute care standardized payment,Per capita Medicare,MGV_PER_CAPITA_STD_PA,SDOH
Per capita Medicare FQHC/RHC actual payment,Per capita Medicare,MGV_PER_CAPITA_ACTUAL_HC,SDOH
Per capita Medicare FQHC/RHC standardized payment,Per capita Medicare,MGV_PER_CAPITA_STD_HC,SDOH
"Prevention quality overall composite per 100,000 male Medicare (dual and non-dual) beneficiaries",Prevention quality overall,MMD_OVERALL_PQI_M_RATE,SDOH
"Prevention quality overall composite per 100,000 female Medicare (dual and non-dual) beneficiaries",Prevention quality overall,MMD_OVERALL_PQI_F_RATE,SDOH
"Prevention quality overall composite per 100,000 White Medicare (dual and non-dual) beneficiaries",Prevention quality overall,MMD_OVERALL_PQI_WHITE_RATE,SDOH
"Prevention quality overall composite per 100,000 Black Medicare (dual and non-dual) beneficiaries",Prevention quality overall,MMD_OVERALL_PQI_BLACK_RATE,SDOH
"Prevention quality overall composite per 100,000 other race Medicare (dual and non-dual) beneficiaries",Prevention quality overall,MMD_OVERALL_PQI_OTHER_RATE,SDOH
"Prevention quality overall composite per 100,000 Asian or Pacific Islander Medicare (dual and non-dual) beneficiaries",Prevention quality overall,MMD_OVERALL_PQI_ASIAN_RATE,SDOH
"Prevention quality overall composite per 100,000 Hispanic Medicare (dual and non-dual) beneficiaries",Prevention quality overall,MMD_OVERALL_PQI_HISP_RATE,SDOH
"Prevention quality overall composite per 100,000 American Indian or Alaska Native Medicare (dual and non-dual) beneficiaries",Prevention quality overall,MMD_OVERALL_PQI_AIAN_RATE,SDOH
"Prevention quality acute composite per 100,000 male Medicare (dual and non-dual) beneficiaries",Prevention quality acute,MMD_ACUTE_PQI_M_RATE,SDOH
"Prevention quality acute composite per 100,000 female Medicare (dual and non-dual) beneficiaries",Prevention quality acute,MMD_ACUTE_PQI_F_RATE,SDOH
"Prevention quality acute composite per 100,000 White Medicare (dual and non-dual) beneficiaries",Prevention quality acute,MMD_ACUTE_PQI_WHITE_RATE,SDOH
"Prevention quality acute composite per 100,000 Black Medicare (dual and non-dual) beneficiaries",Prevention quality acute,MMD_ACUTE_PQI_BLACK_RATE,SDOH
"Prevention quality acute composite per 100,000 other race Medicare (dual and non-dual) beneficiaries",Prevention quality acute,MMD_ACUTE_PQI_OTHER_RATE,SDOH
"Prevention quality acute composite per 100,000 Asian or Pacific Islander Medicare (dual and non-dual) beneficiaries",Prevention quality acute,MMD_ACUTE_PQI_ASIAN_RATE,SDOH
"Prevention quality acute composite per 100,000 Hispanic Medicare (dual and non-dual) beneficiaries",Prevention quality acute,MMD_ACUTE_PQI_HISP_RATE,SDOH
"Prevention quality acute composite per 100,000 American Indian or Alaska Native Medicare (dual and non-dual) beneficiaries",Prevention quality acute,MMD_ACUTE_PQI_AIAN_RATE,SDOH
"Prevention quality chronic composite per 100,000 male Medicare (dual and non-dual) beneficiaries",Prevention quality chronic,MMD_CHRONIC_PQI_M_RATE,SDOH
"Prevention quality chronic composite per 100,000 female Medicare (dual and non-dual) beneficiaries",Prevention quality chronic,MMD_CHRONIC_PQI_F_RATE,SDOH
"Prevention quality chronic composite per 100,000 White Medicare (dual and non-dual) beneficiaries",Prevention quality chronic,MMD_CHRONIC_PQI_WHITE_RATE,SDOH
"Prevention quality chronic composite per 100,000 Black Medicare (dual and non-dual) beneficiaries",Prevention quality chronic,MMD_CHRONIC_PQI_BLACK_RATE,SDOH
"Prevention quality chronic composite per 100,000 other race Medicare (dual and non-dual) beneficiaries",Prevention quality chronic,MMD_CHRONIC_PQI_OTHER_RATE,SDOH
"Prevention quality chronic composite per 100,000 Asian or Pacific Islander Medicare (dual and non-dual) beneficiaries",Prevention quality chronic,MMD_CHRONIC_PQI_ASIAN_RATE,SDOH
"Prevention quality chronic composite per 100,000 Hispanic Medicare (dual and non-dual) beneficiaries",Prevention quality chronic,MMD_CHRONIC_PQI_HISP_RATE,SDOH
"Prevention quality chronic composite per 100,000 American Indian or Alaska Native Medicare (dual and non-dual) beneficiaries",Prevention quality chronic,MMD_CHRONIC_PQI_AIAN_RATE,SDOH
"Emergency department visits per 1,000 male Medicare (dual and non-dual) beneficiaries",Emergency department visits,MMD_ED_VISITS_M_RATE,SDOH
"Emergency department visits per 1,000 female Medicare (dual and non-dual) beneficiaries",Emergency department visits,MMD_ED_VISITS_F_RATE,SDOH
"Emergency department visits per 1,000 White Medicare (dual and non-dual) beneficiaries",Emergency department visits,MMD_ED_VISITS_WHITE_RATE,SDOH
"Emergency department visits per 1,000 Black Medicare (dual and non-dual) beneficiaries",Emergency department visits,MMD_ED_VISITS_BLACK_RATE,SDOH
"Emergency department visits per 1,000 other race Medicare (dual and non-dual) beneficiaries",Emergency department visits,MMD_ED_VISITS_OTHER_RATE,SDOH
"Emergency department visits per 1,000 Asian or Pacific Islander Medicare (dual and non-dual) beneficiaries",Emergency department visits,MMD_ED_VISITS_ASIAN_RATE,SDOH
"Emergency department visits per 1,000 Hispanic Medicare (dual and non-dual) beneficiaries",Emergency department visits,MMD_ED_VISITS_HISP_RATE,SDOH
"Emergency department visits per 1,000 American Indian or Alaska Native Medicare (dual and non-dual) beneficiaries",Emergency department visits,MMD_ED_VISITS_AIAN_RATE,SDOH
"Emergency department visits per 1,000 Medicare only beneficiaries",Emergency department visits,MMD_ED_VISITS_MED_RATE,SDOH
"Emergency department visits per 1,000 dual beneficiaries",Emergency department visits,MMD_ED_VISITS_DUAL_RATE,SDOH
All cause readmissions per 100 male admissions,All cause readmissions,MMD_READM_M_RATE,SDOH
All cause readmissions per 100 female admissions,All cause readmissions,MMD_READM_F_RATE,SDOH
All cause readmissions per 100 White admissions,All cause readmissions,MMD_READM_WHITE_RATE,SDOH
All cause readmissions per 100 Black admissions,All cause readmissions,MMD_READM_BLACK_RATE,SDOH
All cause readmissions per 100 other race admissions,All cause readmissions,MMD_READM_OTHER_RATE,SDOH
All cause readmissions per 100 Asian or Pacific Islander admissions,All cause readmissions,MMD_READM_ASIAN_RATE,SDOH
All cause readmissions per 100 Hispanic admissions,All cause readmissions,MMD_READM_HISP_RATE,SDOH
All cause readmissions per 100 American Indian or Alaska Native admissions,All cause readmissions,MMD_READM_AIAN_RATE,SDOH
Prevalence of anxiety disorders among Medicare (dual and non-dual) beneficiaries,Prevalence of anxiety,MMD_ANXIETY_DISD,SDOH
Prevalence of bipolar disorder among Medicare (dual and non-dual) beneficiaries,Prevalence of bipolar,MMD_BIPOLAR_DISD,SDOH
Prevalence of depressive disorders among Medicare (dual and non-dual) beneficiaries,Prevalence of depressive,MMD_DEPR_DISD,SDOH
Prevalence of personality disorders among Medicare (dual and non-dual) beneficiaries,Prevalence of personality,MMD_PERSONALITY_DISD,SDOH
Prevalence of the overarching Opioid Use Disorder (OUD) indicator among Medicare (dual and non-dual) beneficiaries,Prevalence of the,MMD_OUD_IND,SDOH
Percentage of clinicians who accept Medicare Approved Amounts in full,Percentage of clinicians,PC_PCT_MEDICARE_APPRVD_FULL_AMT,SDOH
Percentage of clinicians who may accept the Medicare Approved Amounts,Percentage of clinicians,PC_PCT_MCARE_MAY_ACPT_APPRVD_AMT,SDOH
"Median distance in miles to the nearest emergency department, calculated using population weighted tract centroids in the county",Median distance in,POS_MEDIAN_DIST_ED,SDOH
"Mean distance in miles to the nearest emergency department, calculated using population weighted tract centroids in the county",Mean distance in,POS_MEAN_DIST_ED,SDOH
"Minimum distance in miles to the nearest emergency department, calculated using population weighted tract centroids in the county",Minimum distance in,POS_MIN_DIST_ED,SDOH
"Maximum distance in miles to the nearest emergency department, calculated using population weighted tract centroids in the county",Maximum distance in,POS_MAX_DIST_ED,SDOH
"Median distance in miles to the nearest medical-surgical ICU, calculated using population weighted tract centroids in the county",Median distance in,POS_MEDIAN_DIST_MEDSURG_ICU,SDOH
"Mean distance in miles to the nearest medical-surgical ICU, calculated using population weighted tract centroids in the county",Mean distance in,POS_MEAN_DIST_MEDSURG_ICU,SDOH
"Minimum distance in miles to the nearest medical-surgical ICU, calculated using population weighted tract centroids in the county",Minimum distance in,POS_MIN_DIST_MEDSURG_ICU,SDOH
"Maximum distance in miles to the nearest medical-surgical ICU, calculated using population weighted tract centroids in the county",Maximum distance in,POS_MAX_DIST_MEDSURG_ICU,SDOH
"Median distance in miles to the nearest designated trauma center, calculated using population weighted tract centroids in the county",Median distance in,POS_MEDIAN_DIST_TRAUMA,SDOH
"Mean distance in miles to the nearest designated trauma center, calculated using population weighted tract centroids in the county",Mean distance in,POS_MEAN_DIST_TRAUMA,SDOH
"Minimum distance in miles to the nearest designated trauma center, calculated using population weighted tract centroids in the county",Minimum distance in,POS_MIN_DIST_TRAUMA,SDOH
"Maximum distance in miles to the nearest designated trauma center, calculated using population weighted tract centroids in the county",Maximum distance in,POS_MAX_DIST_TRAUMA,SDOH
"Median distance in miles to the nearest pediatric ICU, calculated using population weighted tract centroids in the county",Median distance in,POS_MEDIAN_DIST_PED_ICU,SDOH
"Mean distance in miles to the nearest pediatric ICU, calculated using population weighted tract centroids in the county",Mean distance in,POS_MEAN_DIST_PED_ICU,SDOH
"Minimum distance in miles to the nearest pediatric ICU, calculated using population weighted tract centroids in the county",Minimum distance in,POS_MIN_DIST_PED_ICU,SDOH
"Maximum distance in miles to the nearest pediatric ICU, calculated using population weighted tract centroids in the county",Maximum distance in,POS_MAX_DIST_PED_ICU,SDOH
"Median distance in miles to the nearest obstetrics department, calculated using population weighted tract centroids in the county",Median distance in,POS_MEDIAN_DIST_OBSTETRICS,SDOH
"Mean distance in miles to the nearest obstetrics department, calculated using population weighted tract centroids in the county",Mean distance in,POS_MEAN_DIST_OBSTETRICS,SDOH
"Minimum distance in miles to the nearest obstetrics department, calculated using population weighted tract centroids in the county",Minimum distance in,POS_MIN_DIST_OBSTETRICS,SDOH
"Maximum distance in miles to the nearest obstetrics department, calculated using population weighted tract centroids in the county",Maximum distance in,POS_MAX_DIST_OBSTETRICS,SDOH
"Median distance in miles to the nearest health clinic (FQHC, RHC), calculated using population weighted tract centroids in the county",Median distance in,POS_MEDIAN_DIST_CLINIC,SDOH
"Mean distance in miles to the nearest health clinic (FQHC, RHC), calculated using population weighted tract centroids in the county",Mean distance in,POS_MEAN_DIST_CLINIC,SDOH
"Minimum distance in miles to the nearest health clinic (FQHC, RHC), calculated using population weighted tract centroids in the county",Minimum distance in,POS_MIN_DIST_CLINIC,SDOH
"Maximum distance in miles to the nearest health clinic (FQHC, RHC), calculated using population weighted tract centroids in the county",Maximum distance in,POS_MAX_DIST_CLINIC,SDOH
"Median distance in miles to the nearest hospital with alcohol and drug abuse inpatient care, calculated using population weighted tract centroids in the county",Median distance in,POS_MEDIAN_DIST_ALC,SDOH
