Measure_Clean,Measure_Short,SDOH_Column,Data_Type
"Mean distance in miles to the nearest hospital with alcohol and drug abuse inpatient care, calculated using population weighted tract centroids in the county",Mean distance in,POS_MEAN_DIST_ALC,SDOH
"Minimum distance in miles to the nearest hospital with alcohol and drug abuse inpatient care, calculated using population weighted tract centroids in the county",Minimum distance in,POS_MIN_DIST_ALC,SDOH
"Maximum distance in miles to the nearest hospital with alcohol and drug abuse inpatient care, calculated using population weighted tract centroids in the county",Maximum distance in,POS_MAX_DIST_ALC,SDOH
Total number of Federally Qualified Health Centers (FQHCs),Total number of,POS_TOT_FQHC,SDOH
"Total number of Federally Qualified Health Centers (FQHCs) per 1,000 population",Total number of,POS_FQHC_RATE,SDOH
Total number of Community Mental Health Centers,Total number of,POS_TOT_CMHC,SDOH
"Total number of Community Mental Health Centers per 1,000 population",Total number of,POS_CMHC_RATE,SDOH
Total number of Rural Health Clinics (RHCs),Total number of,POS_TOT_RHC,SDOH
"Total number of Rural Health Clinics (RHCs) per 1,000 population",Total number of,POS_RHC_RATE,SDOH
Total number of home health agencies,Total number of,POS_TOT_HHA,SDOH
"Total number of home health agencies per 1,000 population",Total number of,POS_HHA_RATE,SDOH
Total number of hospices,Total number of,POS_TOT_HOSPICE,SDOH
"Total number of hospices per 1,000 population",Total number of,POS_HOSPICE_RATE,SDOH
Total number of ambulatory surgical centers,Total number of,POS_TOT_ASC,SDOH
"Total number of ambulatory surgical centers per 1,000 population",Total number of,POS_ASC_RATE,SDOH
Total number of nursing facilities,Total number of,POS_TOT_NF,SDOH
"Total number of nursing facilities per 1,000 population",Total number of,POS_NF_RATE,SDOH
Total number of nursing facility certified beds,Total number of,POS_TOT_NF_BEDS,SDOH
"Total number of nursing facility certified beds per 1,000 population",Total number of,POS_NF_BEDS_RATE,SDOH
Total number of skilled nursing facilities,Total number of,POS_TOT_SNF,SDOH
"Total number of skilled nursing facilities per 1,000 population",Total number of,POS_SNF_RATE,SDOH
Total number of skilled nursing facility certified beds,Total number of,POS_TOT_SNF_BEDS,SDOH
"Total number of skilled nursing facility certified beds per 1,000 population",Total number of,POS_SNF_BEDS_RATE,SDOH
Total number of hospitals with obstetric care,Total number of,POS_TOT_HOSP_OBSTETRIC,SDOH
"Total number of hospitals with obstetric care per 1,000 population",Total number of,POS_HOSP_OBSTETRIC_RATE,SDOH
Total number of hospitals with pediatric ICU,Total number of,POS_TOT_HOSP_PED_ICU,SDOH
"Total number of hospitals with pediatric ICU per 1,000 population",Total number of,POS_HOSP_PED_ICU_RATE,SDOH
Total number of hospitals with burn care,Total number of,POS_TOT_HOSP_BURN,SDOH
"Total number of hospitals with burn care per 1,000 population",Total number of,POS_HOSP_BURN_RATE,SDOH
Total number of hospitals with medical-surgical ICU,Total number of,POS_TOT_HOSP_MEDSURG_ICU,SDOH
"Total number of hospitals with medical-surgical ICU per 1,000 population",Total number of,POS_HOSP_MEDSURG_ICU_RATE,SDOH
Total number of hospitals with rehabilitative care,Total number of,POS_TOT_HOSP_REHAB,SDOH
"Total number of hospitals with rehabilitative care per 1,000 population",Total number of,POS_HOSP_REHAB_RATE,SDOH
Total number of hospitals with alcohol and/or drug abuse inpatient care,Total number of,POS_TOT_HOSP_ALC,SDOH
"Total number of hospitals with alcohol and/or drug abuse inpatient care per 1,000 population",Total number of,POS_HOSP_ALC_RATE,SDOH
Total number of hospitals with psychiatric care,Total number of,POS_TOT_HOSP_PSYCH,SDOH
"Total number of hospitals with psychiatric care per 1,000 population",Total number of,POS_HOSP_PSYCH_RATE,SDOH
Total number of hospitals with ambulance services,Total number of,POS_TOT_HOSP_AMBULANCE,SDOH
"Total number of hospitals with ambulance services per 1,000 population",Total number of,POS_HOSP_AMBULANCE_RATE,SDOH
Total number of hospitals with chemotherapy,Total number of,POS_TOT_HOSP_CHEMO,SDOH
"Total number of hospitals with chemotherapy per 1,000 population",Total number of,POS_HOSP_CHEMO_RATE,SDOH
Total number of hospitals with emergency department,Total number of,POS_TOT_HOSP_ED,SDOH
"Total number of hospitals with emergency department per 1,000 population",Total number of,POS_HOSP_ED_RATE,SDOH
Percentage of hospitals that are private for-profit hospitals,Percentage of hospitals,POS_PCT_HOSP_FOR_PROFIT,SDOH
Percentage of hospitals that are private not-for-profit hospitals,Percentage of hospitals,POS_PCT_HOSP_NON_PROFIT,SDOH
"Percentage of hospitals that are government (federal, state, local, district) hospitals",Percentage of hospitals,POS_PCT_HOSP_GOV,SDOH
American Indian/Alaska Native areas/Hawaiian home land indicator,American Indian/Alaska Native,CEN_AIAN_NH_IND,SDOH
